{
  "$schema": "../schemas/source.schema.json",
  "acquisition": {
    "distribution_sha256": null,
    "distribution_url": null,
    "metadata_url": null,
    "method": "local_installation",
    "official_url": "https://support.apple.com/guide/photo-booth/welcome/mac"
  },
  "analysis_profile": "notification-sound-db-bs1770-v1",
  "application": {
    "build": "1177",
    "bundle_id": "com.apple.PhotoBooth",
    "version": "13.1"
  },
  "collection": {
    "reason": null,
    "reason_code": null,
    "status": "measured"
  },
  "kind": "application",
  "measurement_failures": [],
  "names": {
    "en": "Photo Booth",
    "ja": "Photo Booth"
  },
  "observed_at": "2026-08-09T05:11:22Z",
  "platform": {
    "architecture": "arm64",
    "build": "25G76",
    "id": "macos",
    "version": "26.6.1"
  },
  "schema_version": "1.0.0",
  "sounds": [
    {
      "asset_sha256": "1ced2ef47ae6dc93f65d39f23941f1ec5d0543dad48fa7368bd884776e8bff3c",
      "event_type": "ui_feedback",
      "name": "action",
      "relative_path": "Contents/Resources/action.aif"
    }
  ],
  "source_id": "apple-photo-booth",
  "vendor": "Apple"
}
