{
  "$schema": "../schemas/source.schema.json",
  "acquisition": {
    "distribution_sha256": null,
    "distribution_url": null,
    "metadata_url": null,
    "method": "local_installation",
    "official_url": "https://support.apple.com/guide/audio-midi-setup/welcome/mac"
  },
  "analysis_profile": "notification-sound-db-bs1770-v2",
  "application": {
    "build": "3.8",
    "bundle_id": "com.apple.audio.AudioMIDISetup",
    "version": "3.8"
  },
  "collection": {
    "reason": null,
    "reason_code": null,
    "status": "measured"
  },
  "kind": "application",
  "measurement_failures": [],
  "names": {
    "en": "Audio MIDI Setup",
    "ja": "Audio MIDI設定"
  },
  "observed_at": "2026-08-09T06:27:29Z",
  "platform": {
    "architecture": "arm64",
    "build": "25G76",
    "id": "macos",
    "version": "26.6.1"
  },
  "schema_version": "1.1.0",
  "sounds": [
    {
      "asset_sha256": "f0d9c340dde6843a096db596ea8298186957e9acccdb275b30de1f733acc4296",
      "event_type": "ui_feedback",
      "name": "MIDIReceivedSound",
      "relative_path": "Contents/Resources/MIDIReceivedSound.aiff"
    }
  ],
  "source_id": "apple-audio-midi-setup",
  "vendor": "Apple"
}
